
*** Running vivado
    with args -log design_1_wrapper.vdi -applog -m64 -product Vivado -messageDb vivado.pb -mode batch -source design_1_wrapper.tcl -notrace


****** Vivado v2018.2 (64-bit)
  **** SW Build 2258646 on Thu Jun 14 20:03:12 MDT 2018
  **** IP Build 2256618 on Thu Jun 14 22:10:49 MDT 2018
    ** Copyright 1986-2018 Xilinx, Inc. All Rights Reserved.

source design_1_wrapper.tcl -notrace
INFO: [IP_Flow 19-234] Refreshing IP repositories
INFO: [IP_Flow 19-1700] Loaded user IP repository 'c:/Users/Anderson/ip_repo/myip_1.0'.
WARNING: [IP_Flow 19-2207] Repository 'c:/Users/Anderson/ip_repo/myip_1.0' already exists; ignoring attempt to add it again.
INFO: [IP_Flow 19-1700] Loaded user IP repository 'c:/Users/Anderson/ip_repo/myip_1.0'.
INFO: [IP_Flow 19-2313] Loaded Vivado IP repository 'C:/Xilinx/Vivado/2018.2/data/ip'.
Command: link_design -top design_1_wrapper -part xc7z020clg400-1
Design is defaulting to srcset: sources_1
Design is defaulting to constrset: constrs_1
INFO: [Project 1-454] Reading design checkpoint 'c:/Users/Anderson/AXILite IP_0120/AXILite IP_0120.srcs/sources_1/bd/design_1/ip/design_1_myip_0_0/design_1_myip_0_0.dcp' for cell 'design_1_i/myip_0'
INFO: [Project 1-454] Reading design checkpoint 'c:/Users/Anderson/AXILite IP_0120/AXILite IP_0120.srcs/sources_1/bd/design_1/ip/design_1_processing_system7_0_0/design_1_processing_system7_0_0.dcp' for cell 'design_1_i/processing_system7_0'
INFO: [Project 1-454] Reading design checkpoint 'c:/Users/Anderson/AXILite IP_0120/AXILite IP_0120.srcs/sources_1/bd/design_1/ip/design_1_rst_ps7_0_100M_0/design_1_rst_ps7_0_100M_0.dcp' for cell 'design_1_i/rst_ps7_0_100M'
INFO: [Project 1-454] Reading design checkpoint 'c:/Users/Anderson/AXILite IP_0120/AXILite IP_0120.srcs/sources_1/bd/design_1/ip/design_1_auto_pc_0/design_1_auto_pc_0.dcp' for cell 'design_1_i/ps7_0_axi_periph/s00_couplers/auto_pc'
INFO: [Netlist 29-17] Analyzing 18 Unisim elements for replacement
INFO: [Netlist 29-28] Unisim Transformation completed in 0 CPU seconds
INFO: [Project 1-479] Netlist was created with Vivado 2018.2
INFO: [Device 21-403] Loading part xc7z020clg400-1
INFO: [Project 1-570] Preparing netlist for logic optimization
Parsing XDC File [c:/Users/Anderson/AXILite IP_0120/AXILite IP_0120.srcs/sources_1/bd/design_1/ip/design_1_processing_system7_0_0/design_1_processing_system7_0_0.xdc] for cell 'design_1_i/processing_system7_0/inst'
Finished Parsing XDC File [c:/Users/Anderson/AXILite IP_0120/AXILite IP_0120.srcs/sources_1/bd/design_1/ip/design_1_processing_system7_0_0/design_1_processing_system7_0_0.xdc] for cell 'design_1_i/processing_system7_0/inst'
Parsing XDC File [c:/Users/Anderson/AXILite IP_0120/AXILite IP_0120.srcs/sources_1/bd/design_1/ip/design_1_rst_ps7_0_100M_0/design_1_rst_ps7_0_100M_0_board.xdc] for cell 'design_1_i/rst_ps7_0_100M/U0'
Finished Parsing XDC File [c:/Users/Anderson/AXILite IP_0120/AXILite IP_0120.srcs/sources_1/bd/design_1/ip/design_1_rst_ps7_0_100M_0/design_1_rst_ps7_0_100M_0_board.xdc] for cell 'design_1_i/rst_ps7_0_100M/U0'
Parsing XDC File [c:/Users/Anderson/AXILite IP_0120/AXILite IP_0120.srcs/sources_1/bd/design_1/ip/design_1_rst_ps7_0_100M_0/design_1_rst_ps7_0_100M_0.xdc] for cell 'design_1_i/rst_ps7_0_100M/U0'
Finished Parsing XDC File [c:/Users/Anderson/AXILite IP_0120/AXILite IP_0120.srcs/sources_1/bd/design_1/ip/design_1_rst_ps7_0_100M_0/design_1_rst_ps7_0_100M_0.xdc] for cell 'design_1_i/rst_ps7_0_100M/U0'
Parsing XDC File [C:/Users/Anderson/AXILite IP_0120/AXILite IP_0120.srcs/constrs_1/new/constraints.xdc]
WARNING: [Vivado 12-584] No ports matched 'sws_2bits_tri_i[0]'. [C:/Users/Anderson/AXILite IP_0120/AXILite IP_0120.srcs/constrs_1/new/constraints.xdc:2]
CRITICAL WARNING: [Common 17-55] 'set_property' expects at least one object. [C:/Users/Anderson/AXILite IP_0120/AXILite IP_0120.srcs/constrs_1/new/constraints.xdc:2]
Resolution: If [get_<value>] was used to populate the object, check to make sure this command returns at least one valid object.
WARNING: [Vivado 12-584] No ports matched 'sws_2bits_tri_i[1]'. [C:/Users/Anderson/AXILite IP_0120/AXILite IP_0120.srcs/constrs_1/new/constraints.xdc:3]
CRITICAL WARNING: [Common 17-55] 'set_property' expects at least one object. [C:/Users/Anderson/AXILite IP_0120/AXILite IP_0120.srcs/constrs_1/new/constraints.xdc:3]
Resolution: If [get_<value>] was used to populate the object, check to make sure this command returns at least one valid object.
WARNING: [Vivado 12-584] No ports matched 'IIC_1_scl_io'. [C:/Users/Anderson/AXILite IP_0120/AXILite IP_0120.srcs/constrs_1/new/constraints.xdc:6]
CRITICAL WARNING: [Common 17-55] 'set_property' expects at least one object. [C:/Users/Anderson/AXILite IP_0120/AXILite IP_0120.srcs/constrs_1/new/constraints.xdc:6]
Resolution: If [get_<value>] was used to populate the object, check to make sure this command returns at least one valid object.
WARNING: [Vivado 12-584] No ports matched 'IIC_1_scl_io'. [C:/Users/Anderson/AXILite IP_0120/AXILite IP_0120.srcs/constrs_1/new/constraints.xdc:7]
CRITICAL WARNING: [Common 17-55] 'set_property' expects at least one object. [C:/Users/Anderson/AXILite IP_0120/AXILite IP_0120.srcs/constrs_1/new/constraints.xdc:7]
Resolution: If [get_<value>] was used to populate the object, check to make sure this command returns at least one valid object.
WARNING: [Vivado 12-584] No ports matched 'IIC_1_sda_io'. [C:/Users/Anderson/AXILite IP_0120/AXILite IP_0120.srcs/constrs_1/new/constraints.xdc:8]
CRITICAL WARNING: [Common 17-55] 'set_property' expects at least one object. [C:/Users/Anderson/AXILite IP_0120/AXILite IP_0120.srcs/constrs_1/new/constraints.xdc:8]
Resolution: If [get_<value>] was used to populate the object, check to make sure this command returns at least one valid object.
WARNING: [Vivado 12-584] No ports matched 'IIC_1_sda_io'. [C:/Users/Anderson/AXILite IP_0120/AXILite IP_0120.srcs/constrs_1/new/constraints.xdc:9]
CRITICAL WARNING: [Common 17-55] 'set_property' expects at least one object. [C:/Users/Anderson/AXILite IP_0120/AXILite IP_0120.srcs/constrs_1/new/constraints.xdc:9]
Resolution: If [get_<value>] was used to populate the object, check to make sure this command returns at least one valid object.
WARNING: [Vivado 12-584] No ports matched 'audio_clk_10MHz'. [C:/Users/Anderson/AXILite IP_0120/AXILite IP_0120.srcs/constrs_1/new/constraints.xdc:10]
CRITICAL WARNING: [Common 17-55] 'set_property' expects at least one object. [C:/Users/Anderson/AXILite IP_0120/AXILite IP_0120.srcs/constrs_1/new/constraints.xdc:10]
Resolution: If [get_<value>] was used to populate the object, check to make sure this command returns at least one valid object.
WARNING: [Vivado 12-584] No ports matched 'bclk'. [C:/Users/Anderson/AXILite IP_0120/AXILite IP_0120.srcs/constrs_1/new/constraints.xdc:11]
CRITICAL WARNING: [Common 17-55] 'set_property' expects at least one object. [C:/Users/Anderson/AXILite IP_0120/AXILite IP_0120.srcs/constrs_1/new/constraints.xdc:11]
Resolution: If [get_<value>] was used to populate the object, check to make sure this command returns at least one valid object.
WARNING: [Vivado 12-584] No ports matched 'lrclk'. [C:/Users/Anderson/AXILite IP_0120/AXILite IP_0120.srcs/constrs_1/new/constraints.xdc:12]
CRITICAL WARNING: [Common 17-55] 'set_property' expects at least one object. [C:/Users/Anderson/AXILite IP_0120/AXILite IP_0120.srcs/constrs_1/new/constraints.xdc:12]
Resolution: If [get_<value>] was used to populate the object, check to make sure this command returns at least one valid object.
WARNING: [Vivado 12-584] No ports matched 'sdata_o'. [C:/Users/Anderson/AXILite IP_0120/AXILite IP_0120.srcs/constrs_1/new/constraints.xdc:13]
CRITICAL WARNING: [Common 17-55] 'set_property' expects at least one object. [C:/Users/Anderson/AXILite IP_0120/AXILite IP_0120.srcs/constrs_1/new/constraints.xdc:13]
Resolution: If [get_<value>] was used to populate the object, check to make sure this command returns at least one valid object.
WARNING: [Vivado 12-584] No ports matched 'sdata_i'. [C:/Users/Anderson/AXILite IP_0120/AXILite IP_0120.srcs/constrs_1/new/constraints.xdc:14]
CRITICAL WARNING: [Common 17-55] 'set_property' expects at least one object. [C:/Users/Anderson/AXILite IP_0120/AXILite IP_0120.srcs/constrs_1/new/constraints.xdc:14]
Resolution: If [get_<value>] was used to populate the object, check to make sure this command returns at least one valid object.
WARNING: [Vivado 12-584] No ports matched 'codec_addr[0]'. [C:/Users/Anderson/AXILite IP_0120/AXILite IP_0120.srcs/constrs_1/new/constraints.xdc:15]
CRITICAL WARNING: [Common 17-55] 'set_property' expects at least one object. [C:/Users/Anderson/AXILite IP_0120/AXILite IP_0120.srcs/constrs_1/new/constraints.xdc:15]
Resolution: If [get_<value>] was used to populate the object, check to make sure this command returns at least one valid object.
WARNING: [Vivado 12-584] No ports matched 'codec_addr[1]'. [C:/Users/Anderson/AXILite IP_0120/AXILite IP_0120.srcs/constrs_1/new/constraints.xdc:16]
CRITICAL WARNING: [Common 17-55] 'set_property' expects at least one object. [C:/Users/Anderson/AXILite IP_0120/AXILite IP_0120.srcs/constrs_1/new/constraints.xdc:16]
Resolution: If [get_<value>] was used to populate the object, check to make sure this command returns at least one valid object.
WARNING: [Vivado 12-584] No ports matched 'btns_4bits_tri_i[0]'. [C:/Users/Anderson/AXILite IP_0120/AXILite IP_0120.srcs/constrs_1/new/constraints.xdc:19]
CRITICAL WARNING: [Common 17-55] 'set_property' expects at least one object. [C:/Users/Anderson/AXILite IP_0120/AXILite IP_0120.srcs/constrs_1/new/constraints.xdc:19]
Resolution: If [get_<value>] was used to populate the object, check to make sure this command returns at least one valid object.
WARNING: [Vivado 12-584] No ports matched 'btns_4bits_tri_i[1]'. [C:/Users/Anderson/AXILite IP_0120/AXILite IP_0120.srcs/constrs_1/new/constraints.xdc:20]
CRITICAL WARNING: [Common 17-55] 'set_property' expects at least one object. [C:/Users/Anderson/AXILite IP_0120/AXILite IP_0120.srcs/constrs_1/new/constraints.xdc:20]
Resolution: If [get_<value>] was used to populate the object, check to make sure this command returns at least one valid object.
WARNING: [Vivado 12-584] No ports matched 'btns_4bits_tri_i[2]'. [C:/Users/Anderson/AXILite IP_0120/AXILite IP_0120.srcs/constrs_1/new/constraints.xdc:21]
CRITICAL WARNING: [Common 17-55] 'set_property' expects at least one object. [C:/Users/Anderson/AXILite IP_0120/AXILite IP_0120.srcs/constrs_1/new/constraints.xdc:21]
Resolution: If [get_<value>] was used to populate the object, check to make sure this command returns at least one valid object.
WARNING: [Vivado 12-584] No ports matched 'btns_4bits_tri_i[3]'. [C:/Users/Anderson/AXILite IP_0120/AXILite IP_0120.srcs/constrs_1/new/constraints.xdc:22]
CRITICAL WARNING: [Common 17-55] 'set_property' expects at least one object. [C:/Users/Anderson/AXILite IP_0120/AXILite IP_0120.srcs/constrs_1/new/constraints.xdc:22]
Resolution: If [get_<value>] was used to populate the object, check to make sure this command returns at least one valid object.
WARNING: [Vivado 12-584] No ports matched 'rgbleds_6bits_tri_o[0]'. [C:/Users/Anderson/AXILite IP_0120/AXILite IP_0120.srcs/constrs_1/new/constraints.xdc:31]
CRITICAL WARNING: [Common 17-55] 'set_property' expects at least one object. [C:/Users/Anderson/AXILite IP_0120/AXILite IP_0120.srcs/constrs_1/new/constraints.xdc:31]
Resolution: If [get_<value>] was used to populate the object, check to make sure this command returns at least one valid object.
WARNING: [Vivado 12-584] No ports matched 'rgbleds_6bits_tri_o[1]'. [C:/Users/Anderson/AXILite IP_0120/AXILite IP_0120.srcs/constrs_1/new/constraints.xdc:32]
CRITICAL WARNING: [Common 17-55] 'set_property' expects at least one object. [C:/Users/Anderson/AXILite IP_0120/AXILite IP_0120.srcs/constrs_1/new/constraints.xdc:32]
Resolution: If [get_<value>] was used to populate the object, check to make sure this command returns at least one valid object.
WARNING: [Vivado 12-584] No ports matched 'rgbleds_6bits_tri_o[2]'. [C:/Users/Anderson/AXILite IP_0120/AXILite IP_0120.srcs/constrs_1/new/constraints.xdc:33]
CRITICAL WARNING: [Common 17-55] 'set_property' expects at least one object. [C:/Users/Anderson/AXILite IP_0120/AXILite IP_0120.srcs/constrs_1/new/constraints.xdc:33]
Resolution: If [get_<value>] was used to populate the object, check to make sure this command returns at least one valid object.
WARNING: [Vivado 12-584] No ports matched 'rgbleds_6bits_tri_o[3]'. [C:/Users/Anderson/AXILite IP_0120/AXILite IP_0120.srcs/constrs_1/new/constraints.xdc:34]
CRITICAL WARNING: [Common 17-55] 'set_property' expects at least one object. [C:/Users/Anderson/AXILite IP_0120/AXILite IP_0120.srcs/constrs_1/new/constraints.xdc:34]
Resolution: If [get_<value>] was used to populate the object, check to make sure this command returns at least one valid object.
WARNING: [Vivado 12-584] No ports matched 'rgbleds_6bits_tri_o[4]'. [C:/Users/Anderson/AXILite IP_0120/AXILite IP_0120.srcs/constrs_1/new/constraints.xdc:35]
CRITICAL WARNING: [Common 17-55] 'set_property' expects at least one object. [C:/Users/Anderson/AXILite IP_0120/AXILite IP_0120.srcs/constrs_1/new/constraints.xdc:35]
Resolution: If [get_<value>] was used to populate the object, check to make sure this command returns at least one valid object.
WARNING: [Vivado 12-584] No ports matched 'rgbleds_6bits_tri_o[5]'. [C:/Users/Anderson/AXILite IP_0120/AXILite IP_0120.srcs/constrs_1/new/constraints.xdc:36]
CRITICAL WARNING: [Common 17-55] 'set_property' expects at least one object. [C:/Users/Anderson/AXILite IP_0120/AXILite IP_0120.srcs/constrs_1/new/constraints.xdc:36]
Resolution: If [get_<value>] was used to populate the object, check to make sure this command returns at least one valid object.
WARNING: [Vivado 12-584] No ports matched 'pmoda_rpi_gpio_tri_io[1]'. [C:/Users/Anderson/AXILite IP_0120/AXILite IP_0120.srcs/constrs_1/new/constraints.xdc:40]
CRITICAL WARNING: [Common 17-55] 'set_property' expects at least one object. [C:/Users/Anderson/AXILite IP_0120/AXILite IP_0120.srcs/constrs_1/new/constraints.xdc:40]
Resolution: If [get_<value>] was used to populate the object, check to make sure this command returns at least one valid object.
WARNING: [Vivado 12-584] No ports matched 'pmoda_rpi_gpio_tri_io[0]'. [C:/Users/Anderson/AXILite IP_0120/AXILite IP_0120.srcs/constrs_1/new/constraints.xdc:41]
CRITICAL WARNING: [Common 17-55] 'set_property' expects at least one object. [C:/Users/Anderson/AXILite IP_0120/AXILite IP_0120.srcs/constrs_1/new/constraints.xdc:41]
Resolution: If [get_<value>] was used to populate the object, check to make sure this command returns at least one valid object.
WARNING: [Vivado 12-584] No ports matched 'pmoda_rpi_gpio_tri_io[3]'. [C:/Users/Anderson/AXILite IP_0120/AXILite IP_0120.srcs/constrs_1/new/constraints.xdc:42]
CRITICAL WARNING: [Common 17-55] 'set_property' expects at least one object. [C:/Users/Anderson/AXILite IP_0120/AXILite IP_0120.srcs/constrs_1/new/constraints.xdc:42]
Resolution: If [get_<value>] was used to populate the object, check to make sure this command returns at least one valid object.
WARNING: [Vivado 12-584] No ports matched 'pmoda_rpi_gpio_tri_io[2]'. [C:/Users/Anderson/AXILite IP_0120/AXILite IP_0120.srcs/constrs_1/new/constraints.xdc:43]
CRITICAL WARNING: [Common 17-55] 'set_property' expects at least one object. [C:/Users/Anderson/AXILite IP_0120/AXILite IP_0120.srcs/constrs_1/new/constraints.xdc:43]
Resolution: If [get_<value>] was used to populate the object, check to make sure this command returns at least one valid object.
WARNING: [Vivado 12-584] No ports matched 'pmoda_rpi_gpio_tri_io[5]'. [C:/Users/Anderson/AXILite IP_0120/AXILite IP_0120.srcs/constrs_1/new/constraints.xdc:44]
CRITICAL WARNING: [Common 17-55] 'set_property' expects at least one object. [C:/Users/Anderson/AXILite IP_0120/AXILite IP_0120.srcs/constrs_1/new/constraints.xdc:44]
Resolution: If [get_<value>] was used to populate the object, check to make sure this command returns at least one valid object.
WARNING: [Vivado 12-584] No ports matched 'pmoda_rpi_gpio_tri_io[4]'. [C:/Users/Anderson/AXILite IP_0120/AXILite IP_0120.srcs/constrs_1/new/constraints.xdc:45]
CRITICAL WARNING: [Common 17-55] 'set_property' expects at least one object. [C:/Users/Anderson/AXILite IP_0120/AXILite IP_0120.srcs/constrs_1/new/constraints.xdc:45]
Resolution: If [get_<value>] was used to populate the object, check to make sure this command returns at least one valid object.
WARNING: [Vivado 12-584] No ports matched 'pmoda_rpi_gpio_tri_io[7]'. [C:/Users/Anderson/AXILite IP_0120/AXILite IP_0120.srcs/constrs_1/new/constraints.xdc:46]
CRITICAL WARNING: [Common 17-55] 'set_property' expects at least one object. [C:/Users/Anderson/AXILite IP_0120/AXILite IP_0120.srcs/constrs_1/new/constraints.xdc:46]
Resolution: If [get_<value>] was used to populate the object, check to make sure this command returns at least one valid object.
WARNING: [Vivado 12-584] No ports matched 'pmoda_rpi_gpio_tri_io[6]'. [C:/Users/Anderson/AXILite IP_0120/AXILite IP_0120.srcs/constrs_1/new/constraints.xdc:47]
CRITICAL WARNING: [Common 17-55] 'set_property' expects at least one object. [C:/Users/Anderson/AXILite IP_0120/AXILite IP_0120.srcs/constrs_1/new/constraints.xdc:47]
Resolution: If [get_<value>] was used to populate the object, check to make sure this command returns at least one valid object.
WARNING: [Vivado 12-584] No ports matched 'pmoda_rpi_gpio_tri_io[2]'. [C:/Users/Anderson/AXILite IP_0120/AXILite IP_0120.srcs/constrs_1/new/constraints.xdc:48]
CRITICAL WARNING: [Common 17-55] 'set_property' expects at least one object. [C:/Users/Anderson/AXILite IP_0120/AXILite IP_0120.srcs/constrs_1/new/constraints.xdc:48]
Resolution: If [get_<value>] was used to populate the object, check to make sure this command returns at least one valid object.
WARNING: [Vivado 12-584] No ports matched 'pmoda_rpi_gpio_tri_io[3]'. [C:/Users/Anderson/AXILite IP_0120/AXILite IP_0120.srcs/constrs_1/new/constraints.xdc:49]
CRITICAL WARNING: [Common 17-55] 'set_property' expects at least one object. [C:/Users/Anderson/AXILite IP_0120/AXILite IP_0120.srcs/constrs_1/new/constraints.xdc:49]
Resolution: If [get_<value>] was used to populate the object, check to make sure this command returns at least one valid object.
WARNING: [Vivado 12-584] No ports matched 'pmoda_rpi_gpio_tri_io[6]'. [C:/Users/Anderson/AXILite IP_0120/AXILite IP_0120.srcs/constrs_1/new/constraints.xdc:50]
CRITICAL WARNING: [Common 17-55] 'set_property' expects at least one object. [C:/Users/Anderson/AXILite IP_0120/AXILite IP_0120.srcs/constrs_1/new/constraints.xdc:50]
Resolution: If [get_<value>] was used to populate the object, check to make sure this command returns at least one valid object.
WARNING: [Vivado 12-584] No ports matched 'pmoda_rpi_gpio_tri_io[7]'. [C:/Users/Anderson/AXILite IP_0120/AXILite IP_0120.srcs/constrs_1/new/constraints.xdc:51]
CRITICAL WARNING: [Common 17-55] 'set_property' expects at least one object. [C:/Users/Anderson/AXILite IP_0120/AXILite IP_0120.srcs/constrs_1/new/constraints.xdc:51]
Resolution: If [get_<value>] was used to populate the object, check to make sure this command returns at least one valid object.
WARNING: [Vivado 12-584] No ports matched 'pmodb_gpio_tri_io[1]'. [C:/Users/Anderson/AXILite IP_0120/AXILite IP_0120.srcs/constrs_1/new/constraints.xdc:54]
CRITICAL WARNING: [Common 17-55] 'set_property' expects at least one object. [C:/Users/Anderson/AXILite IP_0120/AXILite IP_0120.srcs/constrs_1/new/constraints.xdc:54]
Resolution: If [get_<value>] was used to populate the object, check to make sure this command returns at least one valid object.
WARNING: [Vivado 12-584] No ports matched 'pmodb_gpio_tri_io[0]'. [C:/Users/Anderson/AXILite IP_0120/AXILite IP_0120.srcs/constrs_1/new/constraints.xdc:55]
CRITICAL WARNING: [Common 17-55] 'set_property' expects at least one object. [C:/Users/Anderson/AXILite IP_0120/AXILite IP_0120.srcs/constrs_1/new/constraints.xdc:55]
Resolution: If [get_<value>] was used to populate the object, check to make sure this command returns at least one valid object.
WARNING: [Vivado 12-584] No ports matched 'pmodb_gpio_tri_io[3]'. [C:/Users/Anderson/AXILite IP_0120/AXILite IP_0120.srcs/constrs_1/new/constraints.xdc:56]
CRITICAL WARNING: [Common 17-55] 'set_property' expects at least one object. [C:/Users/Anderson/AXILite IP_0120/AXILite IP_0120.srcs/constrs_1/new/constraints.xdc:56]
Resolution: If [get_<value>] was used to populate the object, check to make sure this command returns at least one valid object.
WARNING: [Vivado 12-584] No ports matched 'pmodb_gpio_tri_io[2]'. [C:/Users/Anderson/AXILite IP_0120/AXILite IP_0120.srcs/constrs_1/new/constraints.xdc:57]
CRITICAL WARNING: [Common 17-55] 'set_property' expects at least one object. [C:/Users/Anderson/AXILite IP_0120/AXILite IP_0120.srcs/constrs_1/new/constraints.xdc:57]
Resolution: If [get_<value>] was used to populate the object, check to make sure this command returns at least one valid object.
WARNING: [Vivado 12-584] No ports matched 'pmodb_gpio_tri_io[5]'. [C:/Users/Anderson/AXILite IP_0120/AXILite IP_0120.srcs/constrs_1/new/constraints.xdc:58]
CRITICAL WARNING: [Common 17-55] 'set_property' expects at least one object. [C:/Users/Anderson/AXILite IP_0120/AXILite IP_0120.srcs/constrs_1/new/constraints.xdc:58]
Resolution: If [get_<value>] was used to populate the object, check to make sure this command returns at least one valid object.
WARNING: [Vivado 12-584] No ports matched 'pmodb_gpio_tri_io[4]'. [C:/Users/Anderson/AXILite IP_0120/AXILite IP_0120.srcs/constrs_1/new/constraints.xdc:59]
CRITICAL WARNING: [Common 17-55] 'set_property' expects at least one object. [C:/Users/Anderson/AXILite IP_0120/AXILite IP_0120.srcs/constrs_1/new/constraints.xdc:59]
Resolution: If [get_<value>] was used to populate the object, check to make sure this command returns at least one valid object.
WARNING: [Vivado 12-584] No ports matched 'pmodb_gpio_tri_io[7]'. [C:/Users/Anderson/AXILite IP_0120/AXILite IP_0120.srcs/constrs_1/new/constraints.xdc:60]
CRITICAL WARNING: [Common 17-55] 'set_property' expects at least one object. [C:/Users/Anderson/AXILite IP_0120/AXILite IP_0120.srcs/constrs_1/new/constraints.xdc:60]
Resolution: If [get_<value>] was used to populate the object, check to make sure this command returns at least one valid object.
WARNING: [Vivado 12-584] No ports matched 'pmodb_gpio_tri_io[6]'. [C:/Users/Anderson/AXILite IP_0120/AXILite IP_0120.srcs/constrs_1/new/constraints.xdc:61]
CRITICAL WARNING: [Common 17-55] 'set_property' expects at least one object. [C:/Users/Anderson/AXILite IP_0120/AXILite IP_0120.srcs/constrs_1/new/constraints.xdc:61]
Resolution: If [get_<value>] was used to populate the object, check to make sure this command returns at least one valid object.
WARNING: [Vivado 12-584] No ports matched 'pmodb_gpio_tri_io[2]'. [C:/Users/Anderson/AXILite IP_0120/AXILite IP_0120.srcs/constrs_1/new/constraints.xdc:62]
CRITICAL WARNING: [Common 17-55] 'set_property' expects at least one object. [C:/Users/Anderson/AXILite IP_0120/AXILite IP_0120.srcs/constrs_1/new/constraints.xdc:62]
Resolution: If [get_<value>] was used to populate the object, check to make sure this command returns at least one valid object.
WARNING: [Vivado 12-584] No ports matched 'pmodb_gpio_tri_io[3]'. [C:/Users/Anderson/AXILite IP_0120/AXILite IP_0120.srcs/constrs_1/new/constraints.xdc:63]
CRITICAL WARNING: [Common 17-55] 'set_property' expects at least one object. [C:/Users/Anderson/AXILite IP_0120/AXILite IP_0120.srcs/constrs_1/new/constraints.xdc:63]
Resolution: If [get_<value>] was used to populate the object, check to make sure this command returns at least one valid object.
WARNING: [Vivado 12-584] No ports matched 'pmodb_gpio_tri_io[6]'. [C:/Users/Anderson/AXILite IP_0120/AXILite IP_0120.srcs/constrs_1/new/constraints.xdc:64]
CRITICAL WARNING: [Common 17-55] 'set_property' expects at least one object. [C:/Users/Anderson/AXILite IP_0120/AXILite IP_0120.srcs/constrs_1/new/constraints.xdc:64]
Resolution: If [get_<value>] was used to populate the object, check to make sure this command returns at least one valid object.
WARNING: [Vivado 12-584] No ports matched 'pmodb_gpio_tri_io[7]'. [C:/Users/Anderson/AXILite IP_0120/AXILite IP_0120.srcs/constrs_1/new/constraints.xdc:65]
CRITICAL WARNING: [Common 17-55] 'set_property' expects at least one object. [C:/Users/Anderson/AXILite IP_0120/AXILite IP_0120.srcs/constrs_1/new/constraints.xdc:65]
Resolution: If [get_<value>] was used to populate the object, check to make sure this command returns at least one valid object.
WARNING: [Vivado 12-584] No ports matched 'arduino_gpio_tri_io[0]'. [C:/Users/Anderson/AXILite IP_0120/AXILite IP_0120.srcs/constrs_1/new/constraints.xdc:68]
CRITICAL WARNING: [Common 17-55] 'set_property' expects at least one object. [C:/Users/Anderson/AXILite IP_0120/AXILite IP_0120.srcs/constrs_1/new/constraints.xdc:68]
Resolution: If [get_<value>] was used to populate the object, check to make sure this command returns at least one valid object.
WARNING: [Vivado 12-584] No ports matched 'arduino_gpio_tri_io[1]'. [C:/Users/Anderson/AXILite IP_0120/AXILite IP_0120.srcs/constrs_1/new/constraints.xdc:69]
CRITICAL WARNING: [Common 17-55] 'set_property' expects at least one object. [C:/Users/Anderson/AXILite IP_0120/AXILite IP_0120.srcs/constrs_1/new/constraints.xdc:69]
Resolution: If [get_<value>] was used to populate the object, check to make sure this command returns at least one valid object.
WARNING: [Vivado 12-584] No ports matched 'arduino_gpio_tri_io[2]'. [C:/Users/Anderson/AXILite IP_0120/AXILite IP_0120.srcs/constrs_1/new/constraints.xdc:70]
CRITICAL WARNING: [Common 17-55] 'set_property' expects at least one object. [C:/Users/Anderson/AXILite IP_0120/AXILite IP_0120.srcs/constrs_1/new/constraints.xdc:70]
Resolution: If [get_<value>] was used to populate the object, check to make sure this command returns at least one valid object.
WARNING: [Vivado 12-584] No ports matched 'arduino_gpio_tri_io[3]'. [C:/Users/Anderson/AXILite IP_0120/AXILite IP_0120.srcs/constrs_1/new/constraints.xdc:71]
CRITICAL WARNING: [Common 17-55] 'set_property' expects at least one object. [C:/Users/Anderson/AXILite IP_0120/AXILite IP_0120.srcs/constrs_1/new/constraints.xdc:71]
Resolution: If [get_<value>] was used to populate the object, check to make sure this command returns at least one valid object.
WARNING: [Vivado 12-584] No ports matched 'arduino_gpio_tri_io[4]'. [C:/Users/Anderson/AXILite IP_0120/AXILite IP_0120.srcs/constrs_1/new/constraints.xdc:72]
CRITICAL WARNING: [Common 17-55] 'set_property' expects at least one object. [C:/Users/Anderson/AXILite IP_0120/AXILite IP_0120.srcs/constrs_1/new/constraints.xdc:72]
Resolution: If [get_<value>] was used to populate the object, check to make sure this command returns at least one valid object.
WARNING: [Vivado 12-584] No ports matched 'arduino_gpio_tri_io[5]'. [C:/Users/Anderson/AXILite IP_0120/AXILite IP_0120.srcs/constrs_1/new/constraints.xdc:73]
CRITICAL WARNING: [Common 17-55] 'set_property' expects at least one object. [C:/Users/Anderson/AXILite IP_0120/AXILite IP_0120.srcs/constrs_1/new/constraints.xdc:73]
Resolution: If [get_<value>] was used to populate the object, check to make sure this command returns at least one valid object.
WARNING: [Vivado 12-584] No ports matched 'arduino_gpio_tri_io[6]'. [C:/Users/Anderson/AXILite IP_0120/AXILite IP_0120.srcs/constrs_1/new/constraints.xdc:74]
CRITICAL WARNING: [Common 17-55] 'set_property' expects at least one object. [C:/Users/Anderson/AXILite IP_0120/AXILite IP_0120.srcs/constrs_1/new/constraints.xdc:74]
Resolution: If [get_<value>] was used to populate the object, check to make sure this command returns at least one valid object.
WARNING: [Vivado 12-584] No ports matched 'arduino_gpio_tri_io[7]'. [C:/Users/Anderson/AXILite IP_0120/AXILite IP_0120.srcs/constrs_1/new/constraints.xdc:75]
CRITICAL WARNING: [Common 17-55] 'set_property' expects at least one object. [C:/Users/Anderson/AXILite IP_0120/AXILite IP_0120.srcs/constrs_1/new/constraints.xdc:75]
Resolution: If [get_<value>] was used to populate the object, check to make sure this command returns at least one valid object.
WARNING: [Vivado 12-584] No ports matched 'arduino_gpio_tri_io[8]'. [C:/Users/Anderson/AXILite IP_0120/AXILite IP_0120.srcs/constrs_1/new/constraints.xdc:76]
CRITICAL WARNING: [Common 17-55] 'set_property' expects at least one object. [C:/Users/Anderson/AXILite IP_0120/AXILite IP_0120.srcs/constrs_1/new/constraints.xdc:76]
Resolution: If [get_<value>] was used to populate the object, check to make sure this command returns at least one valid object.
WARNING: [Vivado 12-584] No ports matched 'arduino_gpio_tri_io[9]'. [C:/Users/Anderson/AXILite IP_0120/AXILite IP_0120.srcs/constrs_1/new/constraints.xdc:77]
CRITICAL WARNING: [Common 17-55] 'set_property' expects at least one object. [C:/Users/Anderson/AXILite IP_0120/AXILite IP_0120.srcs/constrs_1/new/constraints.xdc:77]
Resolution: If [get_<value>] was used to populate the object, check to make sure this command returns at least one valid object.
WARNING: [Vivado 12-584] No ports matched 'arduino_gpio_tri_io[10]'. [C:/Users/Anderson/AXILite IP_0120/AXILite IP_0120.srcs/constrs_1/new/constraints.xdc:78]
CRITICAL WARNING: [Common 17-55] 'set_property' expects at least one object. [C:/Users/Anderson/AXILite IP_0120/AXILite IP_0120.srcs/constrs_1/new/constraints.xdc:78]
Resolution: If [get_<value>] was used to populate the object, check to make sure this command returns at least one valid object.
WARNING: [Vivado 12-584] No ports matched 'arduino_gpio_tri_io[11]'. [C:/Users/Anderson/AXILite IP_0120/AXILite IP_0120.srcs/constrs_1/new/constraints.xdc:79]
CRITICAL WARNING: [Common 17-55] 'set_property' expects at least one object. [C:/Users/Anderson/AXILite IP_0120/AXILite IP_0120.srcs/constrs_1/new/constraints.xdc:79]
Resolution: If [get_<value>] was used to populate the object, check to make sure this command returns at least one valid object.
WARNING: [Vivado 12-584] No ports matched 'arduino_gpio_tri_io[12]'. [C:/Users/Anderson/AXILite IP_0120/AXILite IP_0120.srcs/constrs_1/new/constraints.xdc:80]
CRITICAL WARNING: [Common 17-55] 'set_property' expects at least one object. [C:/Users/Anderson/AXILite IP_0120/AXILite IP_0120.srcs/constrs_1/new/constraints.xdc:80]
Resolution: If [get_<value>] was used to populate the object, check to make sure this command returns at least one valid object.
WARNING: [Vivado 12-584] No ports matched 'arduino_gpio_tri_io[13]'. [C:/Users/Anderson/AXILite IP_0120/AXILite IP_0120.srcs/constrs_1/new/constraints.xdc:81]
CRITICAL WARNING: [Common 17-55] 'set_property' expects at least one object. [C:/Users/Anderson/AXILite IP_0120/AXILite IP_0120.srcs/constrs_1/new/constraints.xdc:81]
Resolution: If [get_<value>] was used to populate the object, check to make sure this command returns at least one valid object.
WARNING: [Vivado 12-584] No ports matched 'arduino_gpio_tri_io[14]'. [C:/Users/Anderson/AXILite IP_0120/AXILite IP_0120.srcs/constrs_1/new/constraints.xdc:82]
CRITICAL WARNING: [Common 17-55] 'set_property' expects at least one object. [C:/Users/Anderson/AXILite IP_0120/AXILite IP_0120.srcs/constrs_1/new/constraints.xdc:82]
Resolution: If [get_<value>] was used to populate the object, check to make sure this command returns at least one valid object.
WARNING: [Vivado 12-584] No ports matched 'arduino_gpio_tri_io[15]'. [C:/Users/Anderson/AXILite IP_0120/AXILite IP_0120.srcs/constrs_1/new/constraints.xdc:83]
CRITICAL WARNING: [Common 17-55] 'set_property' expects at least one object. [C:/Users/Anderson/AXILite IP_0120/AXILite IP_0120.srcs/constrs_1/new/constraints.xdc:83]
Resolution: If [get_<value>] was used to populate the object, check to make sure this command returns at least one valid object.
WARNING: [Vivado 12-584] No ports matched 'arduino_gpio_tri_io[16]'. [C:/Users/Anderson/AXILite IP_0120/AXILite IP_0120.srcs/constrs_1/new/constraints.xdc:84]
CRITICAL WARNING: [Common 17-55] 'set_property' expects at least one object. [C:/Users/Anderson/AXILite IP_0120/AXILite IP_0120.srcs/constrs_1/new/constraints.xdc:84]
Resolution: If [get_<value>] was used to populate the object, check to make sure this command returns at least one valid object.
WARNING: [Vivado 12-584] No ports matched 'arduino_gpio_tri_io[17]'. [C:/Users/Anderson/AXILite IP_0120/AXILite IP_0120.srcs/constrs_1/new/constraints.xdc:85]
CRITICAL WARNING: [Common 17-55] 'set_property' expects at least one object. [C:/Users/Anderson/AXILite IP_0120/AXILite IP_0120.srcs/constrs_1/new/constraints.xdc:85]
Resolution: If [get_<value>] was used to populate the object, check to make sure this command returns at least one valid object.
WARNING: [Vivado 12-584] No ports matched 'arduino_gpio_tri_io[18]'. [C:/Users/Anderson/AXILite IP_0120/AXILite IP_0120.srcs/constrs_1/new/constraints.xdc:86]
CRITICAL WARNING: [Common 17-55] 'set_property' expects at least one object. [C:/Users/Anderson/AXILite IP_0120/AXILite IP_0120.srcs/constrs_1/new/constraints.xdc:86]
Resolution: If [get_<value>] was used to populate the object, check to make sure this command returns at least one valid object.
WARNING: [Vivado 12-584] No ports matched 'arduino_gpio_tri_io[19]'. [C:/Users/Anderson/AXILite IP_0120/AXILite IP_0120.srcs/constrs_1/new/constraints.xdc:87]
CRITICAL WARNING: [Common 17-55] 'set_property' expects at least one object. [C:/Users/Anderson/AXILite IP_0120/AXILite IP_0120.srcs/constrs_1/new/constraints.xdc:87]
Resolution: If [get_<value>] was used to populate the object, check to make sure this command returns at least one valid object.
WARNING: [Vivado 12-584] No ports matched 'arduino_direct_iic_scl_io'. [C:/Users/Anderson/AXILite IP_0120/AXILite IP_0120.srcs/constrs_1/new/constraints.xdc:90]
CRITICAL WARNING: [Common 17-55] 'set_property' expects at least one object. [C:/Users/Anderson/AXILite IP_0120/AXILite IP_0120.srcs/constrs_1/new/constraints.xdc:90]
Resolution: If [get_<value>] was used to populate the object, check to make sure this command returns at least one valid object.
WARNING: [Vivado 12-584] No ports matched 'arduino_direct_iic_sda_io'. [C:/Users/Anderson/AXILite IP_0120/AXILite IP_0120.srcs/constrs_1/new/constraints.xdc:91]
CRITICAL WARNING: [Common 17-55] 'set_property' expects at least one object. [C:/Users/Anderson/AXILite IP_0120/AXILite IP_0120.srcs/constrs_1/new/constraints.xdc:91]
Resolution: If [get_<value>] was used to populate the object, check to make sure this command returns at least one valid object.
WARNING: [Vivado 12-584] No ports matched 'arduino_direct_iic_scl_io'. [C:/Users/Anderson/AXILite IP_0120/AXILite IP_0120.srcs/constrs_1/new/constraints.xdc:92]
CRITICAL WARNING: [Common 17-55] 'set_property' expects at least one object. [C:/Users/Anderson/AXILite IP_0120/AXILite IP_0120.srcs/constrs_1/new/constraints.xdc:92]
Resolution: If [get_<value>] was used to populate the object, check to make sure this command returns at least one valid object.
WARNING: [Vivado 12-584] No ports matched 'arduino_direct_iic_sda_io'. [C:/Users/Anderson/AXILite IP_0120/AXILite IP_0120.srcs/constrs_1/new/constraints.xdc:93]
CRITICAL WARNING: [Common 17-55] 'set_property' expects at least one object. [C:/Users/Anderson/AXILite IP_0120/AXILite IP_0120.srcs/constrs_1/new/constraints.xdc:93]
Resolution: If [get_<value>] was used to populate the object, check to make sure this command returns at least one valid object.
WARNING: [Vivado 12-584] No ports matched 'arduino_direct_spi_io1_io'. [C:/Users/Anderson/AXILite IP_0120/AXILite IP_0120.srcs/constrs_1/new/constraints.xdc:96]
CRITICAL WARNING: [Common 17-55] 'set_property' expects at least one object. [C:/Users/Anderson/AXILite IP_0120/AXILite IP_0120.srcs/constrs_1/new/constraints.xdc:96]
Resolution: If [get_<value>] was used to populate the object, check to make sure this command returns at least one valid object.
WARNING: [Vivado 12-584] No ports matched 'arduino_direct_spi_io0_io'. [C:/Users/Anderson/AXILite IP_0120/AXILite IP_0120.srcs/constrs_1/new/constraints.xdc:97]
CRITICAL WARNING: [Common 17-55] 'set_property' expects at least one object. [C:/Users/Anderson/AXILite IP_0120/AXILite IP_0120.srcs/constrs_1/new/constraints.xdc:97]
Resolution: If [get_<value>] was used to populate the object, check to make sure this command returns at least one valid object.
WARNING: [Vivado 12-584] No ports matched 'arduino_direct_spi_sck_io'. [C:/Users/Anderson/AXILite IP_0120/AXILite IP_0120.srcs/constrs_1/new/constraints.xdc:98]
CRITICAL WARNING: [Common 17-55] 'set_property' expects at least one object. [C:/Users/Anderson/AXILite IP_0120/AXILite IP_0120.srcs/constrs_1/new/constraints.xdc:98]
Resolution: If [get_<value>] was used to populate the object, check to make sure this command returns at least one valid object.
WARNING: [Vivado 12-584] No ports matched 'arduino_direct_spi_ss_io'. [C:/Users/Anderson/AXILite IP_0120/AXILite IP_0120.srcs/constrs_1/new/constraints.xdc:99]
CRITICAL WARNING: [Common 17-55] 'set_property' expects at least one object. [C:/Users/Anderson/AXILite IP_0120/AXILite IP_0120.srcs/constrs_1/new/constraints.xdc:99]
Resolution: If [get_<value>] was used to populate the object, check to make sure this command returns at least one valid object.
WARNING: [Vivado 12-584] No ports matched 'Vaux1_v_n'. [C:/Users/Anderson/AXILite IP_0120/AXILite IP_0120.srcs/constrs_1/new/constraints.xdc:102]
CRITICAL WARNING: [Common 17-55] 'set_property' expects at least one object. [C:/Users/Anderson/AXILite IP_0120/AXILite IP_0120.srcs/constrs_1/new/constraints.xdc:102]
Resolution: If [get_<value>] was used to populate the object, check to make sure this command returns at least one valid object.
WARNING: [Vivado 12-584] No ports matched 'Vaux1_v_p'. [C:/Users/Anderson/AXILite IP_0120/AXILite IP_0120.srcs/constrs_1/new/constraints.xdc:103]
CRITICAL WARNING: [Common 17-55] 'set_property' expects at least one object. [C:/Users/Anderson/AXILite IP_0120/AXILite IP_0120.srcs/constrs_1/new/constraints.xdc:103]
Resolution: If [get_<value>] was used to populate the object, check to make sure this command returns at least one valid object.
WARNING: [Vivado 12-584] No ports matched 'Vaux9_v_n'. [C:/Users/Anderson/AXILite IP_0120/AXILite IP_0120.srcs/constrs_1/new/constraints.xdc:104]
CRITICAL WARNING: [Common 17-55] 'set_property' expects at least one object. [C:/Users/Anderson/AXILite IP_0120/AXILite IP_0120.srcs/constrs_1/new/constraints.xdc:104]
Resolution: If [get_<value>] was used to populate the object, check to make sure this command returns at least one valid object.
WARNING: [Vivado 12-584] No ports matched 'Vaux9_v_p'. [C:/Users/Anderson/AXILite IP_0120/AXILite IP_0120.srcs/constrs_1/new/constraints.xdc:105]
CRITICAL WARNING: [Common 17-55] 'set_property' expects at least one object. [C:/Users/Anderson/AXILite IP_0120/AXILite IP_0120.srcs/constrs_1/new/constraints.xdc:105]
Resolution: If [get_<value>] was used to populate the object, check to make sure this command returns at least one valid object.
WARNING: [Vivado 12-584] No ports matched 'Vaux6_v_n'. [C:/Users/Anderson/AXILite IP_0120/AXILite IP_0120.srcs/constrs_1/new/constraints.xdc:106]
CRITICAL WARNING: [Common 17-55] 'set_property' expects at least one object. [C:/Users/Anderson/AXILite IP_0120/AXILite IP_0120.srcs/constrs_1/new/constraints.xdc:106]
Resolution: If [get_<value>] was used to populate the object, check to make sure this command returns at least one valid object.
WARNING: [Vivado 12-584] No ports matched 'Vaux6_v_p'. [C:/Users/Anderson/AXILite IP_0120/AXILite IP_0120.srcs/constrs_1/new/constraints.xdc:107]
CRITICAL WARNING: [Common 17-55] 'set_property' expects at least one object. [C:/Users/Anderson/AXILite IP_0120/AXILite IP_0120.srcs/constrs_1/new/constraints.xdc:107]
Resolution: If [get_<value>] was used to populate the object, check to make sure this command returns at least one valid object.
WARNING: [Vivado 12-584] No ports matched 'Vaux15_v_n'. [C:/Users/Anderson/AXILite IP_0120/AXILite IP_0120.srcs/constrs_1/new/constraints.xdc:108]
CRITICAL WARNING: [Common 17-55] 'set_property' expects at least one object. [C:/Users/Anderson/AXILite IP_0120/AXILite IP_0120.srcs/constrs_1/new/constraints.xdc:108]
Resolution: If [get_<value>] was used to populate the object, check to make sure this command returns at least one valid object.
WARNING: [Vivado 12-584] No ports matched 'Vaux15_v_p'. [C:/Users/Anderson/AXILite IP_0120/AXILite IP_0120.srcs/constrs_1/new/constraints.xdc:109]
CRITICAL WARNING: [Common 17-55] 'set_property' expects at least one object. [C:/Users/Anderson/AXILite IP_0120/AXILite IP_0120.srcs/constrs_1/new/constraints.xdc:109]
Resolution: If [get_<value>] was used to populate the object, check to make sure this command returns at least one valid object.
WARNING: [Vivado 12-584] No ports matched 'Vaux5_v_n'. [C:/Users/Anderson/AXILite IP_0120/AXILite IP_0120.srcs/constrs_1/new/constraints.xdc:110]
CRITICAL WARNING: [Common 17-55] 'set_property' expects at least one object. [C:/Users/Anderson/AXILite IP_0120/AXILite IP_0120.srcs/constrs_1/new/constraints.xdc:110]
Resolution: If [get_<value>] was used to populate the object, check to make sure this command returns at least one valid object.
WARNING: [Vivado 12-584] No ports matched 'Vaux5_v_p'. [C:/Users/Anderson/AXILite IP_0120/AXILite IP_0120.srcs/constrs_1/new/constraints.xdc:111]
CRITICAL WARNING: [Common 17-55] 'set_property' expects at least one object. [C:/Users/Anderson/AXILite IP_0120/AXILite IP_0120.srcs/constrs_1/new/constraints.xdc:111]
Resolution: If [get_<value>] was used to populate the object, check to make sure this command returns at least one valid object.
WARNING: [Vivado 12-584] No ports matched 'Vaux13_v_n'. [C:/Users/Anderson/AXILite IP_0120/AXILite IP_0120.srcs/constrs_1/new/constraints.xdc:112]
CRITICAL WARNING: [Common 17-55] 'set_property' expects at least one object. [C:/Users/Anderson/AXILite IP_0120/AXILite IP_0120.srcs/constrs_1/new/constraints.xdc:112]
Resolution: If [get_<value>] was used to populate the object, check to make sure this command returns at least one valid object.
WARNING: [Vivado 12-584] No ports matched 'Vaux13_v_p'. [C:/Users/Anderson/AXILite IP_0120/AXILite IP_0120.srcs/constrs_1/new/constraints.xdc:113]
CRITICAL WARNING: [Common 17-55] 'set_property' expects at least one object. [C:/Users/Anderson/AXILite IP_0120/AXILite IP_0120.srcs/constrs_1/new/constraints.xdc:113]
Resolution: If [get_<value>] was used to populate the object, check to make sure this command returns at least one valid object.
WARNING: [Vivado 12-584] No ports matched 'hdmi_in_clk_p'. [C:/Users/Anderson/AXILite IP_0120/AXILite IP_0120.srcs/constrs_1/new/constraints.xdc:116]
CRITICAL WARNING: [Vivado 12-4739] create_clock:No valid object(s) found for '-objects [get_ports hdmi_in_clk_p]'. [C:/Users/Anderson/AXILite IP_0120/AXILite IP_0120.srcs/constrs_1/new/constraints.xdc:116]
Resolution: Check if the specified object(s) exists in the current design. If it does, ensure that the correct design hierarchy was specified for the object. If you are working with clocks, make sure create_clock was used to create the clock object before it is referenced.
WARNING: [Vivado 12-584] No ports matched 'hdmi_in_clk_n'. [C:/Users/Anderson/AXILite IP_0120/AXILite IP_0120.srcs/constrs_1/new/constraints.xdc:119]
CRITICAL WARNING: [Common 17-55] 'set_property' expects at least one object. [C:/Users/Anderson/AXILite IP_0120/AXILite IP_0120.srcs/constrs_1/new/constraints.xdc:119]
Resolution: If [get_<value>] was used to populate the object, check to make sure this command returns at least one valid object.
WARNING: [Vivado 12-584] No ports matched 'hdmi_in_clk_p'. [C:/Users/Anderson/AXILite IP_0120/AXILite IP_0120.srcs/constrs_1/new/constraints.xdc:120]
CRITICAL WARNING: [Common 17-55] 'set_property' expects at least one object. [C:/Users/Anderson/AXILite IP_0120/AXILite IP_0120.srcs/constrs_1/new/constraints.xdc:120]
Resolution: If [get_<value>] was used to populate the object, check to make sure this command returns at least one valid object.
WARNING: [Vivado 12-584] No ports matched 'hdmi_in_data_n[0]'. [C:/Users/Anderson/AXILite IP_0120/AXILite IP_0120.srcs/constrs_1/new/constraints.xdc:121]
CRITICAL WARNING: [Common 17-55] 'set_property' expects at least one object. [C:/Users/Anderson/AXILite IP_0120/AXILite IP_0120.srcs/constrs_1/new/constraints.xdc:121]
Resolution: If [get_<value>] was used to populate the object, check to make sure this command returns at least one valid object.
WARNING: [Vivado 12-584] No ports matched 'hdmi_in_data_p[0]'. [C:/Users/Anderson/AXILite IP_0120/AXILite IP_0120.srcs/constrs_1/new/constraints.xdc:122]
CRITICAL WARNING: [Common 17-55] 'set_property' expects at least one object. [C:/Users/Anderson/AXILite IP_0120/AXILite IP_0120.srcs/constrs_1/new/constraints.xdc:122]
Resolution: If [get_<value>] was used to populate the object, check to make sure this command returns at least one valid object.
WARNING: [Vivado 12-584] No ports matched 'hdmi_in_data_n[1]'. [C:/Users/Anderson/AXILite IP_0120/AXILite IP_0120.srcs/constrs_1/new/constraints.xdc:123]
CRITICAL WARNING: [Common 17-55] 'set_property' expects at least one object. [C:/Users/Anderson/AXILite IP_0120/AXILite IP_0120.srcs/constrs_1/new/constraints.xdc:123]
Resolution: If [get_<value>] was used to populate the object, check to make sure this command returns at least one valid object.
WARNING: [Vivado 12-584] No ports matched 'hdmi_in_data_p[1]'. [C:/Users/Anderson/AXILite IP_0120/AXILite IP_0120.srcs/constrs_1/new/constraints.xdc:124]
CRITICAL WARNING: [Common 17-55] 'set_property' expects at least one object. [C:/Users/Anderson/AXILite IP_0120/AXILite IP_0120.srcs/constrs_1/new/constraints.xdc:124]
Resolution: If [get_<value>] was used to populate the object, check to make sure this command returns at least one valid object.
WARNING: [Vivado 12-584] No ports matched 'hdmi_in_data_n[2]'. [C:/Users/Anderson/AXILite IP_0120/AXILite IP_0120.srcs/constrs_1/new/constraints.xdc:125]
CRITICAL WARNING: [Common 17-55] 'set_property' expects at least one object. [C:/Users/Anderson/AXILite IP_0120/AXILite IP_0120.srcs/constrs_1/new/constraints.xdc:125]
Resolution: If [get_<value>] was used to populate the object, check to make sure this command returns at least one valid object.
WARNING: [Vivado 12-584] No ports matched 'hdmi_in_data_p[2]'. [C:/Users/Anderson/AXILite IP_0120/AXILite IP_0120.srcs/constrs_1/new/constraints.xdc:126]
CRITICAL WARNING: [Common 17-55] 'set_property' expects at least one object. [C:/Users/Anderson/AXILite IP_0120/AXILite IP_0120.srcs/constrs_1/new/constraints.xdc:126]
Resolution: If [get_<value>] was used to populate the object, check to make sure this command returns at least one valid object.
WARNING: [Vivado 12-584] No ports matched 'hdmi_in_hpd[0]'. [C:/Users/Anderson/AXILite IP_0120/AXILite IP_0120.srcs/constrs_1/new/constraints.xdc:127]
CRITICAL WARNING: [Common 17-55] 'set_property' expects at least one object. [C:/Users/Anderson/AXILite IP_0120/AXILite IP_0120.srcs/constrs_1/new/constraints.xdc:127]
Resolution: If [get_<value>] was used to populate the object, check to make sure this command returns at least one valid object.
WARNING: [Vivado 12-584] No ports matched 'hdmi_in_ddc_scl_io'. [C:/Users/Anderson/AXILite IP_0120/AXILite IP_0120.srcs/constrs_1/new/constraints.xdc:128]
CRITICAL WARNING: [Common 17-55] 'set_property' expects at least one object. [C:/Users/Anderson/AXILite IP_0120/AXILite IP_0120.srcs/constrs_1/new/constraints.xdc:128]
Resolution: If [get_<value>] was used to populate the object, check to make sure this command returns at least one valid object.
WARNING: [Vivado 12-584] No ports matched 'hdmi_in_ddc_sda_io'. [C:/Users/Anderson/AXILite IP_0120/AXILite IP_0120.srcs/constrs_1/new/constraints.xdc:129]
CRITICAL WARNING: [Common 17-55] 'set_property' expects at least one object. [C:/Users/Anderson/AXILite IP_0120/AXILite IP_0120.srcs/constrs_1/new/constraints.xdc:129]
Resolution: If [get_<value>] was used to populate the object, check to make sure this command returns at least one valid object.
WARNING: [Vivado 12-584] No ports matched 'hdmi_out_clk_n'. [C:/Users/Anderson/AXILite IP_0120/AXILite IP_0120.srcs/constrs_1/new/constraints.xdc:132]
INFO: [Common 17-14] Message 'Vivado 12-584' appears 100 times and further instances of the messages will be disabled. Use the Tcl command set_msg_config to change the current settings. [C:/Users/Anderson/AXILite IP_0120/AXILite IP_0120.srcs/constrs_1/new/constraints.xdc:132]
CRITICAL WARNING: [Common 17-55] 'set_property' expects at least one object. [C:/Users/Anderson/AXILite IP_0120/AXILite IP_0120.srcs/constrs_1/new/constraints.xdc:132]
Resolution: If [get_<value>] was used to populate the object, check to make sure this command returns at least one valid object.
CRITICAL WARNING: [Common 17-55] 'set_property' expects at least one object. [C:/Users/Anderson/AXILite IP_0120/AXILite IP_0120.srcs/constrs_1/new/constraints.xdc:133]
Resolution: If [get_<value>] was used to populate the object, check to make sure this command returns at least one valid object.
INFO: [Common 17-14] Message 'Common 17-55' appears 100 times and further instances of the messages will be disabled. Use the Tcl command set_msg_config to change the current settings. [C:/Users/Anderson/AXILite IP_0120/AXILite IP_0120.srcs/constrs_1/new/constraints.xdc:133]
Finished Parsing XDC File [C:/Users/Anderson/AXILite IP_0120/AXILite IP_0120.srcs/constrs_1/new/constraints.xdc]
INFO: [Opt 31-138] Pushed 0 inverter(s) to 0 load pin(s).
INFO: [Project 1-111] Unisim Transformation Summary:
No Unisim elements were transformed.

17 Infos, 101 Warnings, 101 Critical Warnings and 0 Errors encountered.
link_design completed successfully
link_design: Time (s): cpu = 00:00:09 ; elapsed = 00:00:13 . Memory (MB): peak = 698.762 ; gain = 370.160
Command: opt_design
Attempting to get a license for feature 'Implementation' and/or device 'xc7z020'
INFO: [Common 17-349] Got license for feature 'Implementation' and/or device 'xc7z020'
Running DRC as a precondition to command opt_design

Starting DRC Task
INFO: [DRC 23-27] Running DRC with 2 threads
INFO: [Project 1-461] DRC finished with 0 Errors
INFO: [Project 1-462] Please refer to the DRC report (report_drc) for more information.

Time (s): cpu = 00:00:01 ; elapsed = 00:00:00.558 . Memory (MB): peak = 707.215 ; gain = 8.453

Starting Cache Timing Information Task
INFO: [Timing 38-35] Done setting XDC timing constraints.
Ending Cache Timing Information Task | Checksum: 2a04d8999

Time (s): cpu = 00:00:09 ; elapsed = 00:00:11 . Memory (MB): peak = 1241.621 ; gain = 534.406

Starting Logic Optimization Task

Phase 1 Retarget
INFO: [Opt 31-138] Pushed 0 inverter(s) to 0 load pin(s).
INFO: [Opt 31-49] Retargeted 0 cell(s).
Phase 1 Retarget | Checksum: 266c21581

Time (s): cpu = 00:00:00 ; elapsed = 00:00:00.161 . Memory (MB): peak = 1241.621 ; gain = 0.000
INFO: [Opt 31-389] Phase Retarget created 0 cells and removed 0 cells

Phase 2 Constant propagation
INFO: [Opt 31-138] Pushed 0 inverter(s) to 0 load pin(s).
Phase 2 Constant propagation | Checksum: 20f14d574

Time (s): cpu = 00:00:00 ; elapsed = 00:00:00.200 . Memory (MB): peak = 1241.621 ; gain = 0.000
INFO: [Opt 31-389] Phase Constant propagation created 0 cells and removed 8 cells

Phase 3 Sweep
Phase 3 Sweep | Checksum: 194b00340

Time (s): cpu = 00:00:01 ; elapsed = 00:00:00.545 . Memory (MB): peak = 1241.621 ; gain = 0.000
INFO: [Opt 31-389] Phase Sweep created 4 cells and removed 389 cells

Phase 4 BUFG optimization
Phase 4 BUFG optimization | Checksum: 194b00340

Time (s): cpu = 00:00:01 ; elapsed = 00:00:00.601 . Memory (MB): peak = 1241.621 ; gain = 0.000
INFO: [Opt 31-662] Phase BUFG optimization created 0 cells of which 0 are BUFGs and removed 0 cells.

Phase 5 Shift Register Optimization
Phase 5 Shift Register Optimization | Checksum: 277d92f89

Time (s): cpu = 00:00:01 ; elapsed = 00:00:00.780 . Memory (MB): peak = 1241.621 ; gain = 0.000
INFO: [Opt 31-389] Phase Shift Register Optimization created 0 cells and removed 0 cells

Phase 6 Post Processing Netlist
Phase 6 Post Processing Netlist | Checksum: 225bcb039

Time (s): cpu = 00:00:01 ; elapsed = 00:00:00.817 . Memory (MB): peak = 1241.621 ; gain = 0.000
INFO: [Opt 31-389] Phase Post Processing Netlist created 0 cells and removed 0 cells

Starting Connectivity Check Task

Time (s): cpu = 00:00:00 ; elapsed = 00:00:00.004 . Memory (MB): peak = 1241.621 ; gain = 0.000
Ending Logic Optimization Task | Checksum: 225bcb039

Time (s): cpu = 00:00:01 ; elapsed = 00:00:00.834 . Memory (MB): peak = 1241.621 ; gain = 0.000

Starting Power Optimization Task
INFO: [Pwropt 34-132] Skipping clock gating for clocks with a period < 2.00 ns.
Ending Power Optimization Task | Checksum: 225bcb039

Time (s): cpu = 00:00:00 ; elapsed = 00:00:00.011 . Memory (MB): peak = 1241.621 ; gain = 0.000

Starting Final Cleanup Task
Ending Final Cleanup Task | Checksum: 225bcb039

Time (s): cpu = 00:00:00 ; elapsed = 00:00:00 . Memory (MB): peak = 1241.621 ; gain = 0.000
INFO: [Common 17-83] Releasing license: Implementation
33 Infos, 101 Warnings, 101 Critical Warnings and 0 Errors encountered.
opt_design completed successfully
opt_design: Time (s): cpu = 00:00:11 ; elapsed = 00:00:12 . Memory (MB): peak = 1241.621 ; gain = 542.859
INFO: [Timing 38-480] Writing timing data to binary archive.
Writing placer database...
Writing XDEF routing.
Writing XDEF routing logical nets.
Writing XDEF routing special nets.
Write XDEF Complete: Time (s): cpu = 00:00:00 ; elapsed = 00:00:00.090 . Memory (MB): peak = 1241.621 ; gain = 0.000
INFO: [Common 17-1381] The checkpoint 'C:/Users/Anderson/AXILite IP_0120/AXILite IP_0120.runs/impl_1/design_1_wrapper_opt.dcp' has been generated.
INFO: [runtcl-4] Executing : report_drc -file design_1_wrapper_drc_opted.rpt -pb design_1_wrapper_drc_opted.pb -rpx design_1_wrapper_drc_opted.rpx
Command: report_drc -file design_1_wrapper_drc_opted.rpt -pb design_1_wrapper_drc_opted.pb -rpx design_1_wrapper_drc_opted.rpx
INFO: [DRC 23-27] Running DRC with 2 threads
INFO: [Coretcl 2-168] The results of DRC are in file C:/Users/Anderson/AXILite IP_0120/AXILite IP_0120.runs/impl_1/design_1_wrapper_drc_opted.rpt.
report_drc completed successfully
Command: place_design
Attempting to get a license for feature 'Implementation' and/or device 'xc7z020'
INFO: [Common 17-349] Got license for feature 'Implementation' and/or device 'xc7z020'
INFO: [DRC 23-27] Running DRC with 2 threads
INFO: [Vivado_Tcl 4-198] DRC finished with 0 Errors
INFO: [Vivado_Tcl 4-199] Please refer to the DRC report (report_drc) for more information.
Running DRC as a precondition to command place_design
INFO: [DRC 23-27] Running DRC with 2 threads
INFO: [Vivado_Tcl 4-198] DRC finished with 0 Errors
INFO: [Vivado_Tcl 4-199] Please refer to the DRC report (report_drc) for more information.

Starting Placer Task
INFO: [Place 30-611] Multithreading enabled for place_design using a maximum of 2 CPUs

Phase 1 Placer Initialization

Phase 1.1 Placer Initialization Netlist Sorting
Netlist sorting complete. Time (s): cpu = 00:00:00 ; elapsed = 00:00:00.003 . Memory (MB): peak = 1241.621 ; gain = 0.000
Phase 1.1 Placer Initialization Netlist Sorting | Checksum: 17da38d48

Time (s): cpu = 00:00:00 ; elapsed = 00:00:00.011 . Memory (MB): peak = 1241.621 ; gain = 0.000
Netlist sorting complete. Time (s): cpu = 00:00:00 ; elapsed = 00:00:00.003 . Memory (MB): peak = 1241.621 ; gain = 0.000

Phase 1.2 IO Placement/ Clock Placement/ Build Placer Device
INFO: [Timing 38-35] Done setting XDC timing constraints.
Phase 1.2 IO Placement/ Clock Placement/ Build Placer Device | Checksum: 13326d8d3

Time (s): cpu = 00:00:02 ; elapsed = 00:00:02 . Memory (MB): peak = 1241.621 ; gain = 0.000

Phase 1.3 Build Placer Netlist Model
Phase 1.3 Build Placer Netlist Model | Checksum: 29bae8b00

Time (s): cpu = 00:00:02 ; elapsed = 00:00:02 . Memory (MB): peak = 1241.621 ; gain = 0.000

Phase 1.4 Constrain Clocks/Macros
Phase 1.4 Constrain Clocks/Macros | Checksum: 29bae8b00

Time (s): cpu = 00:00:02 ; elapsed = 00:00:02 . Memory (MB): peak = 1241.621 ; gain = 0.000
Phase 1 Placer Initialization | Checksum: 29bae8b00

Time (s): cpu = 00:00:02 ; elapsed = 00:00:02 . Memory (MB): peak = 1241.621 ; gain = 0.000

Phase 2 Global Placement

Phase 2.1 Floorplanning
Phase 2.1 Floorplanning | Checksum: 22e6c14bb

Time (s): cpu = 00:00:02 ; elapsed = 00:00:02 . Memory (MB): peak = 1241.621 ; gain = 0.000

Phase 2.2 Physical Synthesis In Placer
INFO: [Physopt 32-65] No nets found for high-fanout optimization.
INFO: [Physopt 32-232] Optimized 0 net. Created 0 new instance.
INFO: [Physopt 32-775] End 1 Pass. Optimized 0 net or cell. Created 0 new cell, deleted 0 existing cell and moved 0 existing cell
Netlist sorting complete. Time (s): cpu = 00:00:00 ; elapsed = 00:00:00.003 . Memory (MB): peak = 1241.621 ; gain = 0.000

Summary of Physical Synthesis Optimizations
============================================


-----------------------------------------------------------------------------------------------------------------------------
|  Optimization       |  Added Cells  |  Removed Cells  |  Optimized Cells/Nets  |  Dont Touch  |  Iterations  |  Elapsed   |
-----------------------------------------------------------------------------------------------------------------------------
|  Very High Fanout   |            0  |              0  |                     0  |           0  |           1  |  00:00:00  |
|  Total              |            0  |              0  |                     0  |           0  |           1  |  00:00:00  |
-----------------------------------------------------------------------------------------------------------------------------


Phase 2.2 Physical Synthesis In Placer | Checksum: 21dd5d57e

Time (s): cpu = 00:00:03 ; elapsed = 00:00:05 . Memory (MB): peak = 1241.621 ; gain = 0.000
Phase 2 Global Placement | Checksum: 1ad56ba94

Time (s): cpu = 00:00:03 ; elapsed = 00:00:05 . Memory (MB): peak = 1241.621 ; gain = 0.000

Phase 3 Detail Placement

Phase 3.1 Commit Multi Column Macros
Phase 3.1 Commit Multi Column Macros | Checksum: 1ad56ba94

Time (s): cpu = 00:00:03 ; elapsed = 00:00:05 . Memory (MB): peak = 1241.621 ; gain = 0.000

Phase 3.2 Commit Most Macros & LUTRAMs
Phase 3.2 Commit Most Macros & LUTRAMs | Checksum: 1ec2265b0

Time (s): cpu = 00:00:03 ; elapsed = 00:00:05 . Memory (MB): peak = 1241.621 ; gain = 0.000

Phase 3.3 Area Swap Optimization
Phase 3.3 Area Swap Optimization | Checksum: 19176bafb

Time (s): cpu = 00:00:03 ; elapsed = 00:00:05 . Memory (MB): peak = 1241.621 ; gain = 0.000

Phase 3.4 Pipeline Register Optimization
Phase 3.4 Pipeline Register Optimization | Checksum: 19176bafb

Time (s): cpu = 00:00:03 ; elapsed = 00:00:05 . Memory (MB): peak = 1241.621 ; gain = 0.000

Phase 3.5 Small Shape Detail Placement
Phase 3.5 Small Shape Detail Placement | Checksum: 24535213a

Time (s): cpu = 00:00:03 ; elapsed = 00:00:05 . Memory (MB): peak = 1241.621 ; gain = 0.000

Phase 3.6 Re-assign LUT pins
Phase 3.6 Re-assign LUT pins | Checksum: 1f6fac553

Time (s): cpu = 00:00:03 ; elapsed = 00:00:05 . Memory (MB): peak = 1241.621 ; gain = 0.000

Phase 3.7 Pipeline Register Optimization
Phase 3.7 Pipeline Register Optimization | Checksum: 1f6fac553

Time (s): cpu = 00:00:03 ; elapsed = 00:00:05 . Memory (MB): peak = 1241.621 ; gain = 0.000
Phase 3 Detail Placement | Checksum: 1f6fac553

Time (s): cpu = 00:00:03 ; elapsed = 00:00:05 . Memory (MB): peak = 1241.621 ; gain = 0.000

Phase 4 Post Placement Optimization and Clean-Up

Phase 4.1 Post Commit Optimization
INFO: [Timing 38-35] Done setting XDC timing constraints.

Phase 4.1.1 Post Placement Optimization
Post Placement Optimization Initialization | Checksum: 19052fa2a

Phase 4.1.1.1 BUFG Insertion
INFO: [Place 46-31] BUFG insertion identified 0 candidate nets, 0 success, 0 skipped for placement/routing, 0 skipped for timing, 0 skipped for netlist change reason.
Phase 4.1.1.1 BUFG Insertion | Checksum: 19052fa2a

Time (s): cpu = 00:00:03 ; elapsed = 00:00:06 . Memory (MB): peak = 1265.402 ; gain = 23.781
INFO: [Place 30-746] Post Placement Timing Summary WNS=4.577. For the most accurate timing information please run report_timing.
Phase 4.1.1 Post Placement Optimization | Checksum: 1b0a43fac

Time (s): cpu = 00:00:03 ; elapsed = 00:00:06 . Memory (MB): peak = 1265.402 ; gain = 23.781
Phase 4.1 Post Commit Optimization | Checksum: 1b0a43fac

Time (s): cpu = 00:00:03 ; elapsed = 00:00:06 . Memory (MB): peak = 1265.402 ; gain = 23.781

Phase 4.2 Post Placement Cleanup
Phase 4.2 Post Placement Cleanup | Checksum: 1b0a43fac

Time (s): cpu = 00:00:03 ; elapsed = 00:00:06 . Memory (MB): peak = 1265.402 ; gain = 23.781

Phase 4.3 Placer Reporting
Phase 4.3 Placer Reporting | Checksum: 1b0a43fac

Time (s): cpu = 00:00:03 ; elapsed = 00:00:06 . Memory (MB): peak = 1265.402 ; gain = 23.781

Phase 4.4 Final Placement Cleanup
Phase 4.4 Final Placement Cleanup | Checksum: 1fdbafcff

Time (s): cpu = 00:00:03 ; elapsed = 00:00:06 . Memory (MB): peak = 1265.402 ; gain = 23.781
Phase 4 Post Placement Optimization and Clean-Up | Checksum: 1fdbafcff

Time (s): cpu = 00:00:03 ; elapsed = 00:00:06 . Memory (MB): peak = 1265.402 ; gain = 23.781
Ending Placer Task | Checksum: 17224d3c5

Time (s): cpu = 00:00:03 ; elapsed = 00:00:06 . Memory (MB): peak = 1265.402 ; gain = 23.781
INFO: [Common 17-83] Releasing license: Implementation
54 Infos, 101 Warnings, 101 Critical Warnings and 0 Errors encountered.
place_design completed successfully
place_design: Time (s): cpu = 00:00:05 ; elapsed = 00:00:07 . Memory (MB): peak = 1265.402 ; gain = 23.781
INFO: [Timing 38-480] Writing timing data to binary archive.
Writing placer database...
Writing XDEF routing.
Writing XDEF routing logical nets.
Writing XDEF routing special nets.
Write XDEF Complete: Time (s): cpu = 00:00:01 ; elapsed = 00:00:00.191 . Memory (MB): peak = 1272.992 ; gain = 7.590
INFO: [Common 17-1381] The checkpoint 'C:/Users/Anderson/AXILite IP_0120/AXILite IP_0120.runs/impl_1/design_1_wrapper_placed.dcp' has been generated.
INFO: [runtcl-4] Executing : report_io -file design_1_wrapper_io_placed.rpt
report_io: Time (s): cpu = 00:00:00 ; elapsed = 00:00:00.057 . Memory (MB): peak = 1272.992 ; gain = 0.000
INFO: [runtcl-4] Executing : report_utilization -file design_1_wrapper_utilization_placed.rpt -pb design_1_wrapper_utilization_placed.pb
report_utilization: Time (s): cpu = 00:00:00 ; elapsed = 00:00:00.045 . Memory (MB): peak = 1272.992 ; gain = 0.000
INFO: [runtcl-4] Executing : report_control_sets -verbose -file design_1_wrapper_control_sets_placed.rpt
report_control_sets: Time (s): cpu = 00:00:00 ; elapsed = 00:00:00.009 . Memory (MB): peak = 1272.992 ; gain = 0.000
Command: route_design
Attempting to get a license for feature 'Implementation' and/or device 'xc7z020'
INFO: [Common 17-349] Got license for feature 'Implementation' and/or device 'xc7z020'
Running DRC as a precondition to command route_design
INFO: [DRC 23-27] Running DRC with 2 threads
INFO: [Vivado_Tcl 4-198] DRC finished with 0 Errors
INFO: [Vivado_Tcl 4-199] Please refer to the DRC report (report_drc) for more information.


Starting Routing Task
INFO: [Route 35-254] Multithreading enabled for route_design using a maximum of 2 CPUs
Checksum: PlaceDB: 8573a528 ConstDB: 0 ShapeSum: ecb12e9d RouteDB: 0

Phase 1 Build RT Design
Phase 1 Build RT Design | Checksum: f7cab5a6

Time (s): cpu = 00:00:27 ; elapsed = 00:00:24 . Memory (MB): peak = 1392.430 ; gain = 119.438
Post Restoration Checksum: NetGraph: 9189ce3c NumContArr: 6640e76a Constraints: 0 Timing: 0

Phase 2 Router Initialization

Phase 2.1 Create Timer
Phase 2.1 Create Timer | Checksum: f7cab5a6

Time (s): cpu = 00:00:27 ; elapsed = 00:00:24 . Memory (MB): peak = 1392.430 ; gain = 119.438

Phase 2.2 Fix Topology Constraints
Phase 2.2 Fix Topology Constraints | Checksum: f7cab5a6

Time (s): cpu = 00:00:27 ; elapsed = 00:00:24 . Memory (MB): peak = 1399.254 ; gain = 126.262

Phase 2.3 Pre Route Cleanup
Phase 2.3 Pre Route Cleanup | Checksum: f7cab5a6

Time (s): cpu = 00:00:27 ; elapsed = 00:00:24 . Memory (MB): peak = 1399.254 ; gain = 126.262
 Number of Nodes with overlaps = 0

Phase 2.4 Update Timing
Phase 2.4 Update Timing | Checksum: 17a371c75

Time (s): cpu = 00:00:27 ; elapsed = 00:00:24 . Memory (MB): peak = 1420.410 ; gain = 147.418
INFO: [Route 35-416] Intermediate Timing Summary | WNS=4.593  | TNS=0.000  | WHS=-0.196 | THS=-13.146|

Phase 2 Router Initialization | Checksum: 1d0789eeb

Time (s): cpu = 00:00:27 ; elapsed = 00:00:24 . Memory (MB): peak = 1420.410 ; gain = 147.418

Phase 3 Initial Routing
Phase 3 Initial Routing | Checksum: 273363e1e

Time (s): cpu = 00:00:28 ; elapsed = 00:00:25 . Memory (MB): peak = 1420.410 ; gain = 147.418

Phase 4 Rip-up And Reroute

Phase 4.1 Global Iteration 0
 Number of Nodes with overlaps = 85
 Number of Nodes with overlaps = 5
 Number of Nodes with overlaps = 0
INFO: [Route 35-416] Intermediate Timing Summary | WNS=4.260  | TNS=0.000  | WHS=N/A    | THS=N/A    |

Phase 4.1 Global Iteration 0 | Checksum: 205da225d

Time (s): cpu = 00:00:28 ; elapsed = 00:00:25 . Memory (MB): peak = 1420.410 ; gain = 147.418

Phase 4.2 Global Iteration 1
 Number of Nodes with overlaps = 0
INFO: [Route 35-416] Intermediate Timing Summary | WNS=4.260  | TNS=0.000  | WHS=N/A    | THS=N/A    |

Phase 4.2 Global Iteration 1 | Checksum: 152644fe1

Time (s): cpu = 00:00:28 ; elapsed = 00:00:25 . Memory (MB): peak = 1420.410 ; gain = 147.418
Phase 4 Rip-up And Reroute | Checksum: 152644fe1

Time (s): cpu = 00:00:28 ; elapsed = 00:00:25 . Memory (MB): peak = 1420.410 ; gain = 147.418

Phase 5 Delay and Skew Optimization

Phase 5.1 Delay CleanUp
Phase 5.1 Delay CleanUp | Checksum: 152644fe1

Time (s): cpu = 00:00:28 ; elapsed = 00:00:25 . Memory (MB): peak = 1420.410 ; gain = 147.418

Phase 5.2 Clock Skew Optimization
Phase 5.2 Clock Skew Optimization | Checksum: 152644fe1

Time (s): cpu = 00:00:28 ; elapsed = 00:00:25 . Memory (MB): peak = 1420.410 ; gain = 147.418
Phase 5 Delay and Skew Optimization | Checksum: 152644fe1

Time (s): cpu = 00:00:28 ; elapsed = 00:00:25 . Memory (MB): peak = 1420.410 ; gain = 147.418

Phase 6 Post Hold Fix

Phase 6.1 Hold Fix Iter

Phase 6.1.1 Update Timing
Phase 6.1.1 Update Timing | Checksum: 1b8985e18

Time (s): cpu = 00:00:28 ; elapsed = 00:00:25 . Memory (MB): peak = 1420.410 ; gain = 147.418
INFO: [Route 35-416] Intermediate Timing Summary | WNS=4.375  | TNS=0.000  | WHS=0.040  | THS=0.000  |

Phase 6.1 Hold Fix Iter | Checksum: 15de092b9

Time (s): cpu = 00:00:28 ; elapsed = 00:00:25 . Memory (MB): peak = 1420.410 ; gain = 147.418
Phase 6 Post Hold Fix | Checksum: 15de092b9

Time (s): cpu = 00:00:28 ; elapsed = 00:00:25 . Memory (MB): peak = 1420.410 ; gain = 147.418

Phase 7 Route finalize

Router Utilization Summary
  Global Vertical Routing Utilization    = 0.137672 %
  Global Horizontal Routing Utilization  = 0.182218 %
  Routable Net Status*
  *Does not include unroutable nets such as driverless and loadless.
  Run report_route_status for detailed report.
  Number of Failed Nets               = 0
  Number of Unrouted Nets             = 0
  Number of Partially Routed Nets     = 0
  Number of Node Overlaps             = 0

Phase 7 Route finalize | Checksum: c615e694

Time (s): cpu = 00:00:28 ; elapsed = 00:00:25 . Memory (MB): peak = 1420.410 ; gain = 147.418

Phase 8 Verifying routed nets

 Verification completed successfully
Phase 8 Verifying routed nets | Checksum: c615e694

Time (s): cpu = 00:00:28 ; elapsed = 00:00:25 . Memory (MB): peak = 1420.410 ; gain = 147.418

Phase 9 Depositing Routes
Phase 9 Depositing Routes | Checksum: 14f50abab

Time (s): cpu = 00:00:28 ; elapsed = 00:00:25 . Memory (MB): peak = 1420.410 ; gain = 147.418

Phase 10 Post Router Timing
INFO: [Route 35-57] Estimated Timing Summary | WNS=4.375  | TNS=0.000  | WHS=0.040  | THS=0.000  |

INFO: [Route 35-327] The final timing numbers are based on the router estimated timing analysis. For a complete and accurate timing signoff, please run report_timing_summary.
Phase 10 Post Router Timing | Checksum: 14f50abab

Time (s): cpu = 00:00:28 ; elapsed = 00:00:25 . Memory (MB): peak = 1420.410 ; gain = 147.418
INFO: [Route 35-16] Router Completed Successfully

Time (s): cpu = 00:00:28 ; elapsed = 00:00:25 . Memory (MB): peak = 1420.410 ; gain = 147.418

Routing Is Done.
INFO: [Common 17-83] Releasing license: Implementation
72 Infos, 101 Warnings, 101 Critical Warnings and 0 Errors encountered.
route_design completed successfully
route_design: Time (s): cpu = 00:00:30 ; elapsed = 00:00:27 . Memory (MB): peak = 1420.410 ; gain = 147.418
INFO: [Timing 38-480] Writing timing data to binary archive.
Writing placer database...
Writing XDEF routing.
Writing XDEF routing logical nets.
Writing XDEF routing special nets.
Write XDEF Complete: Time (s): cpu = 00:00:01 ; elapsed = 00:00:00.236 . Memory (MB): peak = 1420.410 ; gain = 0.000
INFO: [Common 17-1381] The checkpoint 'C:/Users/Anderson/AXILite IP_0120/AXILite IP_0120.runs/impl_1/design_1_wrapper_routed.dcp' has been generated.
INFO: [runtcl-4] Executing : report_drc -file design_1_wrapper_drc_routed.rpt -pb design_1_wrapper_drc_routed.pb -rpx design_1_wrapper_drc_routed.rpx
Command: report_drc -file design_1_wrapper_drc_routed.rpt -pb design_1_wrapper_drc_routed.pb -rpx design_1_wrapper_drc_routed.rpx
INFO: [DRC 23-27] Running DRC with 2 threads
INFO: [Coretcl 2-168] The results of DRC are in file C:/Users/Anderson/AXILite IP_0120/AXILite IP_0120.runs/impl_1/design_1_wrapper_drc_routed.rpt.
report_drc completed successfully
INFO: [runtcl-4] Executing : report_methodology -file design_1_wrapper_methodology_drc_routed.rpt -pb design_1_wrapper_methodology_drc_routed.pb -rpx design_1_wrapper_methodology_drc_routed.rpx
Command: report_methodology -file design_1_wrapper_methodology_drc_routed.rpt -pb design_1_wrapper_methodology_drc_routed.pb -rpx design_1_wrapper_methodology_drc_routed.rpx
INFO: [Timing 38-35] Done setting XDC timing constraints.
INFO: [Timing 38-35] Done setting XDC timing constraints.
INFO: [DRC 23-133] Running Methodology with 2 threads
INFO: [Coretcl 2-1520] The results of Report Methodology are in file C:/Users/Anderson/AXILite IP_0120/AXILite IP_0120.runs/impl_1/design_1_wrapper_methodology_drc_routed.rpt.
report_methodology completed successfully
INFO: [runtcl-4] Executing : report_power -file design_1_wrapper_power_routed.rpt -pb design_1_wrapper_power_summary_routed.pb -rpx design_1_wrapper_power_routed.rpx
Command: report_power -file design_1_wrapper_power_routed.rpt -pb design_1_wrapper_power_summary_routed.pb -rpx design_1_wrapper_power_routed.rpx
INFO: [Timing 38-35] Done setting XDC timing constraints.
Running Vector-less Activity Propagation...

Finished Running Vector-less Activity Propagation
84 Infos, 101 Warnings, 101 Critical Warnings and 0 Errors encountered.
report_power completed successfully
INFO: [runtcl-4] Executing : report_route_status -file design_1_wrapper_route_status.rpt -pb design_1_wrapper_route_status.pb
INFO: [runtcl-4] Executing : report_timing_summary -max_paths 10 -file design_1_wrapper_timing_summary_routed.rpt -pb design_1_wrapper_timing_summary_routed.pb -rpx design_1_wrapper_timing_summary_routed.rpx -warn_on_violation 
INFO: [Timing 38-91] UpdateTimingParams: Speed grade: -1, Delay Type: min_max, Timing Stage: Requireds.
INFO: [Timing 38-191] Multithreading enabled for timing update using a maximum of 2 CPUs
INFO: [runtcl-4] Executing : report_incremental_reuse -file design_1_wrapper_incremental_reuse_routed.rpt
INFO: [Vivado_Tcl 4-545] No incremental reuse to report, no incremental placement and routing data was found.
INFO: [runtcl-4] Executing : report_clock_utilization -file design_1_wrapper_clock_utilization_routed.rpt
INFO: [runtcl-4] Executing : report_bus_skew -warn_on_violation -file design_1_wrapper_bus_skew_routed.rpt -pb design_1_wrapper_bus_skew_routed.pb -rpx design_1_wrapper_bus_skew_routed.rpx
INFO: [Timing 38-91] UpdateTimingParams: Speed grade: -1, Delay Type: min_max, Timing Stage: Requireds.
INFO: [Timing 38-191] Multithreading enabled for timing update using a maximum of 2 CPUs
INFO: [Common 17-206] Exiting Vivado at Sun Jan 21 15:56:35 2024...

*** Running vivado
    with args -log design_1_wrapper.vdi -applog -m64 -product Vivado -messageDb vivado.pb -mode batch -source design_1_wrapper.tcl -notrace


****** Vivado v2018.2 (64-bit)
  **** SW Build 2258646 on Thu Jun 14 20:03:12 MDT 2018
  **** IP Build 2256618 on Thu Jun 14 22:10:49 MDT 2018
    ** Copyright 1986-2018 Xilinx, Inc. All Rights Reserved.

source design_1_wrapper.tcl -notrace
Command: open_checkpoint design_1_wrapper_routed.dcp

Starting open_checkpoint Task

Time (s): cpu = 00:00:00 ; elapsed = 00:00:00.030 . Memory (MB): peak = 236.641 ; gain = 0.000
INFO: [Netlist 29-17] Analyzing 6 Unisim elements for replacement
INFO: [Netlist 29-28] Unisim Transformation completed in 0 CPU seconds
INFO: [Project 1-479] Netlist was created with Vivado 2018.2
INFO: [Device 21-403] Loading part xc7z020clg400-1
INFO: [Project 1-570] Preparing netlist for logic optimization
INFO: [Timing 38-478] Restoring timing data from binary archive.
INFO: [Timing 38-479] Binary timing data restore complete.
INFO: [Project 1-856] Restoring constraints from binary archive.
INFO: [Project 1-853] Binary constraint restore complete.
Reading XDEF placement.
Reading placer database...
Reading XDEF routing.
Read XDEF File: Time (s): cpu = 00:00:00 ; elapsed = 00:00:00.347 . Memory (MB): peak = 1147.598 ; gain = 0.000
Restored from archive | CPU: 0.000000 secs | Memory: 0.000000 MB |
Finished XDEF File Restore: Time (s): cpu = 00:00:00 ; elapsed = 00:00:00.347 . Memory (MB): peak = 1147.598 ; gain = 0.000
INFO: [Project 1-111] Unisim Transformation Summary:
No Unisim elements were transformed.

INFO: [Project 1-604] Checkpoint was created with Vivado v2018.2 (64-bit) build 2258646
open_checkpoint: Time (s): cpu = 00:00:17 ; elapsed = 00:00:21 . Memory (MB): peak = 1147.598 ; gain = 919.676
Command: write_bitstream -force design_1_wrapper.bit
Attempting to get a license for feature 'Implementation' and/or device 'xc7z020'
INFO: [Common 17-349] Got license for feature 'Implementation' and/or device 'xc7z020'
Running DRC as a precondition to command write_bitstream
INFO: [IP_Flow 19-234] Refreshing IP repositories
INFO: [IP_Flow 19-1704] No user IP repositories specified
INFO: [IP_Flow 19-2313] Loaded Vivado IP repository 'C:/Xilinx/Vivado/2018.2/data/ip'.
INFO: [DRC 23-27] Running DRC with 2 threads
INFO: [Vivado 12-3199] DRC finished with 0 Errors
INFO: [Vivado 12-3200] Please refer to the DRC report (report_drc) for more information.
INFO: [Designutils 20-2272] Running write_bitstream with 2 threads.
Loading data files...
Loading site data...
Loading route data...
Processing options...
Creating bitmap...
Creating bitstream...
Writing bitstream ./design_1_wrapper.bit...
INFO: [Vivado 12-1842] Bitgen Completed Successfully.
INFO: [Project 1-120] WebTalk data collection is mandatory when using a WebPACK part without a full Vivado license. To see the specific WebTalk data collected for your design, open the usage_statistics_webtalk.html or usage_statistics_webtalk.xml file in the implementation directory.
sQC
sQC
INFO: [Common 17-83] Releasing license: Implementation
22 Infos, 0 Warnings, 0 Critical Warnings and 0 Errors encountered.
write_bitstream completed successfully
write_bitstream: Time (s): cpu = 00:00:18 ; elapsed = 00:00:16 . Memory (MB): peak = 1642.410 ; gain = 494.812
INFO: [Common 17-206] Exiting Vivado at Sun Jan 21 15:58:03 2024...
